{"assumptions": [], "blockers": [], "changeId": "demo-change", "commands": [{"command": "make test", "exitCode": 0, "result": "pass", "workdir": "/tmp/wt"}], "contractVersion": "1", "evidence": ["make test -> pass (code abcdef0)"], "filesChanged": ["pkg/a/impl.py"], "nextAction": "review", "outputs": ["task 1 done"], "results": "all tasks verified", "role": "developer", "runId": "demo-1", "skillsUsed": [{"name": "implementation", "reason": "task execution", "source": ".agent-stack/skills/implementation/SKILL.md", "version": "1.0"}], "status": "done", "verdict": null}
